{
  "$schema": "../schemas/city_input.schema.json",
  "schema_version": "city-1",
  "municipality": "Groningen",
  "lods": [0],
  "include_addresses": true,
  "include_energy_labels": true,
  "cache_dir": "../.cache/citygml_energy_city",
  "output": "../generated/groningen.gml",
  "srs_name": "urn:ogc:def:crs,crs:EPSG::28992,crs:EPSG::5709",
  "srs_dimension": 3,
  "city_model": {
    "name": "Groningen",
    "description": "Full municipality of Groningen: BAG + 3DBAG LoD 0 + EP-online energy labels. Built for BAG vs EP-online year-of-construction comparison."
  }
}
