{
  "$schema": "../schemas/city_input.schema.json",
  "schema_version": "city-1",
  "municipality": "Delft",
  "bbox": [84700, 446400, 85100, 446800],
  "lods": [0, 1, 2],
  "include_addresses": true,
  "include_energy_labels": true,
  "cache_dir": "../.cache/citygml_energy_city",
  "output": "../generated/delft_smoke.gml",
  "srs_name": "urn:ogc:def:crs,crs:EPSG::28992,crs:EPSG::5709",
  "srs_dimension": 3,
  "city_model": {
    "name": "TU Delft campus",
    "description": "All BAG panden within the TU Delft campus bbox, with EP-online energy labels."
  }
}
